{
 "name": "arg-isolation-hook-replaces-and-deletes-nested",
 "authority": "pinned Pi b7bb00b9 agent-loop.ts prepareToolCall/executePreparedToolCall and validation.ts validateToolArguments (structuredClone), sliced unmodified; Node v22.15.1; typebox 1.3.7",
 "pi_revision": "b7bb00b936dbe21b8e160b3e89efdec361846699",
 "requirements": [
  "TOOL-003"
 ],
 "notes": "L0506-D005 (minion-agent#190, provenance #129). GENERATED by assurance/layers/data/l0506-d005/gen; do not edit.",
 "arg_isolation": {
  "raw_text": "{\"o\":{\"k\":1,\"d\":2},\"l\":[1,[2]]}",
  "hooks": [
   [
    {
     "op": "set",
     "path": [
      "o"
     ],
     "key": "k",
     "value": {
      "n": "9"
     }
    },
    {
     "op": "delete",
     "path": [
      "o"
     ],
     "key": "d"
    },
    {
     "op": "push",
     "path": [
      "l",
      1
     ],
     "value": {
      "n": "3"
     }
    }
   ]
  ],
  "facts": [
   {
    "distinct_from_raw": [
     "l",
     1
    ]
   }
  ],
  "expect": {
   "outcome": "executed",
   "hook_entries": [
    {
     "o": [
      [
       "o",
       {
        "o": [
         [
          "k",
          {
           "n": "1"
          }
         ],
         [
          "d",
          {
           "n": "2"
          }
         ]
        ]
       }
      ],
      [
       "l",
       {
        "a": [
         {
          "n": "1"
         },
         {
          "a": [
           {
            "n": "2"
           }
          ]
         }
        ]
       }
      ]
     ]
    }
   ],
   "facts": [
    true
   ],
   "execute": {
    "o": [
     [
      "o",
      {
       "o": [
        [
         "k",
         {
          "n": "9"
         }
        ]
       ]
      }
     ],
     [
      "l",
      {
       "a": [
        {
         "n": "1"
        },
        {
         "a": [
          {
           "n": "2"
          },
          {
           "n": "3"
          }
         ]
        }
       ]
      }
     ]
    ]
   },
   "updates": [
    {
     "o": [
      [
       "o",
       {
        "o": [
         [
          "k",
          {
           "n": "1"
          }
         ],
         [
          "d",
          {
           "n": "2"
          }
         ]
        ]
       }
      ],
      [
       "l",
       {
        "a": [
         {
          "n": "1"
         },
         {
          "a": [
           {
            "n": "2"
           }
          ]
         }
        ]
       }
      ]
     ]
    }
   ],
   "raw_after": {
    "o": [
     [
      "o",
      {
       "o": [
        [
         "k",
         {
          "n": "1"
         }
        ],
        [
         "d",
         {
          "n": "2"
         }
        ]
       ]
      }
     ],
     [
      "l",
      {
       "a": [
        {
         "n": "1"
        },
        {
         "a": [
          {
           "n": "2"
          }
         ]
        }
       ]
      }
     ]
    ]
   }
  }
 }
}
