{
 "name": "arg-isolation-prepared-cycle-survives-clone",
 "authority": "pinned Pi b7bb00b9 agent-loop.ts prepareToolCall/executePreparedToolCall and validation.ts validateToolArguments (structuredClone), sliced unmodified; Node v22.15.1; typebox 1.3.7",
 "pi_revision": "b7bb00b936dbe21b8e160b3e89efdec361846699",
 "requirements": [
  "TOOL-003"
 ],
 "notes": "L0506-D005 (minion-agent#190, provenance #129). GENERATED by assurance/layers/data/l0506-d005/gen; do not edit.",
 "arg_isolation": {
  "raw_text": "{}",
  "prepare": "cycle",
  "hooks": [
   []
  ],
  "facts": [
   {
    "same": [
     [
      "self"
     ],
     []
    ]
   }
  ],
  "expect": {
   "outcome": "executed",
   "hook_entries": [
    {
     "o": [
      [
       "k",
       {
        "n": "1"
       }
      ],
      [
       "self",
       {
        "cycle": 1
       }
      ]
     ]
    }
   ],
   "facts": [
    true
   ],
   "execute": {
    "o": [
     [
      "k",
      {
       "n": "1"
      }
     ],
     [
      "self",
      {
       "cycle": 1
      }
     ]
    ]
   },
   "updates": [
    {
     "o": []
    }
   ],
   "raw_after": {
    "o": []
   }
  }
 }
}
