{
 "name": "arg-isolation-raw-integer-largest-finite-binary64",
 "authority": "pinned Pi b7bb00b9 agent-loop.ts prepareToolCall/executePreparedToolCall and validation.ts validateToolArguments (structuredClone), sliced unmodified; Node v22.15.1; typebox 1.3.7",
 "pi_revision": "b7bb00b936dbe21b8e160b3e89efdec361846699",
 "requirements": [
  "TOOL-003"
 ],
 "notes": "L0506-D005 (minion-agent#190, provenance #129). GENERATED by assurance/layers/data/l0506-d005/gen; do not edit.",
 "arg_isolation": {
  "raw_text": "{\"o\":{\"n\":179769313486231580793728971405303415079934132710037826936173778980444968292764750946649017977587207096330286416692887910946555547851940402630657488671505820681908902000708383676273854845817711531764475730270069855571366959622842914819860834936475292719074168444365510704342711559699508093042880177904174497791}}",
  "hooks": [
   [
    {
     "op": "set",
     "path": [
      "o"
     ],
     "key": "y",
     "value": {
      "n": "1"
     }
    }
   ]
  ],
  "expect": {
   "outcome": "executed",
   "hook_entries": [
    {
     "o": [
      [
       "o",
       {
        "o": [
         [
          "n",
          {
           "n": "1.7976931348623157e+308"
          }
         ]
        ]
       }
      ]
     ]
    }
   ],
   "facts": [],
   "execute": {
    "o": [
     [
      "o",
      {
       "o": [
        [
         "n",
         {
          "n": "1.7976931348623157e+308"
         }
        ],
        [
         "y",
         {
          "n": "1"
         }
        ]
       ]
      }
     ]
    ]
   },
   "updates": [
    {
     "o": [
      [
       "o",
       {
        "o": [
         [
          "n",
          {
           "n": "1.7976931348623157e+308"
          }
         ]
        ]
       }
      ]
     ]
    }
   ],
   "raw_after": {
    "o": [
     [
      "o",
      {
       "o": [
        [
         "n",
         {
          "n": "1.7976931348623157e+308"
         }
        ]
       ]
      }
     ]
    ]
   }
  }
 }
}
