{
 "name": "arg-isolation-prepared-non-finite-values-survive-clone",
 "authority": "pinned Pi b7bb00b9 agent-loop.ts prepareToolCall/executePreparedToolCall and validation.ts validateToolArguments (structuredClone), sliced unmodified; Node v22.15.1; typebox 1.3.7",
 "pi_revision": "b7bb00b936dbe21b8e160b3e89efdec361846699",
 "requirements": [
  "TOOL-003"
 ],
 "notes": "L0506-D005 (minion-agent#190, provenance #129). GENERATED by assurance/layers/data/l0506-d005/gen; do not edit.",
 "arg_isolation": {
  "raw_text": "{\"z\":-0,\"s\":\"\\ud800x\",\"t\":\"\\udc00\"}",
  "prepare": "non-finite",
  "hooks": [
   []
  ],
  "expect": {
   "outcome": "executed",
   "hook_entries": [
    {
     "o": [
      [
       "z",
       {
        "n": "-0"
       }
      ],
      [
       "s",
       {
        "u": [
         55296,
         120
        ]
       }
      ],
      [
       "t",
       {
        "u": [
         56320
        ]
       }
      ],
      [
       "nan",
       {
        "n": "NaN"
       }
      ],
      [
       "inf",
       {
        "n": "Infinity"
       }
      ],
      [
       "ninf",
       {
        "n": "-Infinity"
       }
      ],
      [
       "nz",
       {
        "n": "-0"
       }
      ]
     ]
    }
   ],
   "facts": [],
   "execute": {
    "o": [
     [
      "z",
      {
       "n": "-0"
      }
     ],
     [
      "s",
      {
       "u": [
        55296,
        120
       ]
      }
     ],
     [
      "t",
      {
       "u": [
        56320
       ]
      }
     ],
     [
      "nan",
      {
       "n": "NaN"
      }
     ],
     [
      "inf",
      {
       "n": "Infinity"
      }
     ],
     [
      "ninf",
      {
       "n": "-Infinity"
      }
     ],
     [
      "nz",
      {
       "n": "-0"
      }
     ]
    ]
   },
   "updates": [
    {
     "o": [
      [
       "z",
       {
        "n": "-0"
       }
      ],
      [
       "s",
       {
        "u": [
         55296,
         120
        ]
       }
      ],
      [
       "t",
       {
        "u": [
         56320
        ]
       }
      ]
     ]
    }
   ],
   "raw_after": {
    "o": [
     [
      "z",
      {
       "n": "-0"
      }
     ],
     [
      "s",
      {
       "u": [
        55296,
        120
       ]
      }
     ],
     [
      "t",
      {
       "u": [
        56320
       ]
      }
     ]
    ]
   }
  }
 }
}
