{
 "name": "arg-isolation-hook-pushes-object-into-nested-array",
 "authority": "pinned Pi b7bb00b9 agent-loop.ts prepareToolCall/executePreparedToolCall and validation.ts validateToolArguments (structuredClone), sliced unmodified; Node v22.15.1; typebox 1.3.7",
 "pi_revision": "b7bb00b936dbe21b8e160b3e89efdec361846699",
 "requirements": [
  "TOOL-003"
 ],
 "notes": "L0506-D005 (minion-agent#190, provenance #129). GENERATED by assurance/layers/data/l0506-d005/gen; do not edit.",
 "arg_isolation": {
  "raw_text": "{\"a\":[]}",
  "hooks": [
   [
    {
     "op": "push",
     "path": [
      "a"
     ],
     "value": {
      "o": [
       [
        "b",
        {
         "n": "2"
        }
       ],
       [
        "1",
        {
         "n": "1"
        }
       ]
      ]
     }
    }
   ]
  ],
  "facts": [
   {
    "distinct_from_raw": [
     "a"
    ]
   }
  ],
  "expect": {
   "outcome": "executed",
   "hook_entries": [
    {
     "o": [
      [
       "a",
       {
        "a": []
       }
      ]
     ]
    }
   ],
   "facts": [
    true
   ],
   "execute": {
    "o": [
     [
      "a",
      {
       "a": [
        {
         "o": [
          [
           "1",
           {
            "n": "1"
           }
          ],
          [
           "b",
           {
            "n": "2"
           }
          ]
         ]
        }
       ]
      }
     ]
    ]
   },
   "updates": [
    {
     "o": [
      [
       "a",
       {
        "a": []
       }
      ]
     ]
    }
   ],
   "raw_after": {
    "o": [
     [
      "a",
      {
       "a": []
      }
     ]
    ]
   }
  }
 }
}
