{
 "name": "arg-isolation-prepared-reused-raw-child-is-isolated",
 "authority": "pinned Pi b7bb00b9 agent-loop.ts prepareToolCall/executePreparedToolCall and validation.ts validateToolArguments (structuredClone), sliced unmodified; Node v22.15.1; typebox 1.3.7",
 "pi_revision": "b7bb00b936dbe21b8e160b3e89efdec361846699",
 "requirements": [
  "TOOL-003"
 ],
 "notes": "L0506-D005 (minion-agent#190, provenance #129). GENERATED by assurance/layers/data/l0506-d005/gen; do not edit.",
 "arg_isolation": {
  "raw_text": "{\"o\":{\"z\":1},\"t\":1}",
  "prepare": "reuse-raw-child",
  "hooks": [
   [
    {
     "op": "set",
     "path": [
      "o"
     ],
     "key": "y",
     "value": {
      "n": "2"
     }
    }
   ]
  ],
  "facts": [
   {
    "distinct_from_raw": [
     "o"
    ]
   }
  ],
  "expect": {
   "outcome": "executed",
   "hook_entries": [
    {
     "o": [
      [
       "o",
       {
        "o": [
         [
          "z",
          {
           "n": "1"
          }
         ]
        ]
       }
      ],
      [
       "extra",
       {
        "n": "1"
       }
      ]
     ]
    }
   ],
   "facts": [
    true
   ],
   "execute": {
    "o": [
     [
      "o",
      {
       "o": [
        [
         "z",
         {
          "n": "1"
         }
        ],
        [
         "y",
         {
          "n": "2"
         }
        ]
       ]
      }
     ],
     [
      "extra",
      {
       "n": "1"
      }
     ]
    ]
   },
   "updates": [
    {
     "o": [
      [
       "o",
       {
        "o": [
         [
          "z",
          {
           "n": "1"
          }
         ]
        ]
       }
      ],
      [
       "t",
       {
        "n": "1"
       }
      ]
     ]
    }
   ],
   "raw_after": {
    "o": [
     [
      "o",
      {
       "o": [
        [
         "z",
         {
          "n": "1"
         }
        ]
       ]
      }
     ],
     [
      "t",
      {
       "n": "1"
      }
     ]
    ]
   }
  }
 }
}
